{
  "schema_version": "artifact/v1",
  "id": "blueprint.yaml",
  "type": "technical-deployment-view",
  "schema": "architecture/v1",
  "path": "output\\designs\\blueprint.yaml",
  "sha256": "da06085b7d9adaebb1603650952501f0b6449e76b4d9080e59fd6440a39dc710",
  "model_version": "V1.0",
  "producer": "arch-design",
  "produced_at": "2026-09-14T13:06:02+00:00",
  "input_artifacts": [
    "req.yaml"
  ]
}
