{
  "schema_version": "artifact/v1",
  "id": "validate_result.json",
  "type": "validation-result",
  "schema": "validation/v1",
  "path": "output\\validation\\validate_result.json",
  "sha256": "f7c4117a4e6b030966fc1e069c2cda9f570ba1095fe8b8aadaa3117afbc421c8",
  "model_version": "arch-validate/2.0",
  "producer": "arch-validate",
  "produced_at": "2026-09-15T00:58:31Z",
  "input_artifacts": [
    "diagram.png"
  ]
}
