{
  "schema_version": "artifact/v1",
  "id": "REQ.md",
  "type": "requirements_document",
  "schema": "requirements/v1",
  "path": "output\\requirements\\REQ.md",
  "sha256": "ca9566727375e7c67df7fbb93fbdb40334ee2d11fed0cd880994c11f4c78b744",
  "model_version": null,
  "producer": "arch-requirements",
  "produced_at": "2026-09-14T11:23:29+00:00",
  "input_artifacts": []
}
