{
  "schema_version": "artifact/v1",
  "id": "diagram-png",
  "type": "technical-deployment-view",
  "schema": "image/png",
  "path": "output\\diagrams\\diagram.png",
  "sha256": "a4b0beb0134d7e4095510b75c0afd0d30f89bba18366c3091d3e3471f01d5173",
  "model_version": null,
  "producer": "archharness diagram",
  "produced_at": "2026-09-14T13:39:07+00:00",
  "input_artifacts": [
    "blueprint.yaml"
  ]
}
