{
  "schema_version": "artifact/v1",
  "id": "diagram-drawio",
  "type": "technical-deployment-view",
  "schema": "application/vnd.jgraph.mxfile",
  "path": "output/diagrams/diagram.drawio",
  "sha256": "6986cbf041ebf880dcbafb1d5b773c280b55cc0d1950f5284a38c66ef760796b",
  "model_version": null,
  "producer": "archharness diagram",
  "produced_at": "2026-09-14T13:39:04+00:00",
  "input_artifacts": [
    "blueprint.yaml"
  ]
}
