{
  "schema_version": "artifact/v1",
  "id": "design-blueprint-PMES-US-001-v1.0",
  "type": "technical-deployment-view",
  "schema": "architecture/v1",
  "path": "output/designs/blueprint.yaml",
  "sha256": "812e9390aabe218ee16dd2b9a5eaec4d0cca9d64e7becb27899274b65863e319",
  "model_version": "openai/gpt-5.6-sol",
  "producer": "arch-design",
  "produced_at": "2026-09-14T13:28:51+00:00",
  "input_artifacts": [
    "requirements-req.yaml-20260914"
  ]
}
