{
  "schema_version": "artifact/v1",
  "id": "blueprint-OSP-001",
  "type": "technical-deployment-view",
  "schema": "arch/v1",
  "path": "output\\designs\\blueprint.yaml",
  "sha256": "7978252bb1e33a53d3e2563a2d1f4f30de8db6c806d057926382478a87b1dd8c",
  "model_version": "openai/gpt-5.6-sol",
  "producer": "archharness/0.7.0",
  "produced_at": "2026-09-14T13:29:18Z",
  "input_artifacts": [
    "req-OSP-001",
    "config.yaml",
    "input\\systems-registry.md",
    "tools\\arch-diagram-gen\\templates\\CATALOG.yaml",
    "tools\\arch-diagram-gen\\arch-schema-reference.yaml",
    "tools\\arch-diagram-gen\\templates\\private-cloud.yaml"
  ]
}
