{
  "schema_version": "artifact/v1",
  "id": "REQ.md",
  "type": "requirements_document",
  "schema": "requirements/v2",
  "path": "output\\requirements\\REQ.md",
  "sha256": "cd4b38cbb7b79f917d9499d74c51f008dc830dcf63a97b678f911324fc851208",
  "model_version": null,
  "producer": "arch-requirements",
  "produced_at": "2026-09-24T00:00:00+00:00",
  "input_artifacts": [
    "input/prompt.md",
    "input/diagrams/order-query-portal-20260914.png",
    "input/systems-registry.md",
    "input/documents/requirements.md",
    "input/api/cmdb-export.csv",
    "project.yaml",
    "config.yaml"
  ]
}
