{
  "schema_version": "artifact/v1",
  "id": "req.yaml",
  "type": "requirements",
  "schema": "requirements/v2",
  "path": "output\\requirements\\req.yaml",
  "sha256": "bad4d3a11fd898b2544e17daf7288fc5b4143e88c9573728a8c1213c6a4212eb",
  "model_version": null,
  "producer": "arch-requirements",
  "produced_at": "2026-09-24T00:00:00+00:00",
  "input_artifacts": [
    "input/prompt.md",
    "input/systems-registry.md",
    "input/documents/requirements.md",
    "project.yaml",
    "config.yaml"
  ]
}
