{
  "schema_version": "artifact/v1",
  "id": "req-OSP-001",
  "type": "requirements",
  "schema": "req/v1",
  "path": "output/requirements/req.yaml",
  "sha256": "6f0c1a51e7eac8ecb2ee4d541a82215c8974068923ec359555b9976f9644e66d",
  "model_version": "openai/gpt-5.6-sol",
  "producer": "archharness/0.7.0",
  "produced_at": "2026-09-14T11:26:47+00:00",
  "input_artifacts": [
    "input\\prompt.md",
    "input\\diagrams\\supply-chain-order-20260914.png",
    "input\\systems-registry.md",
    "input\\documents\\requirements.md",
    "project.yaml",
    "config.yaml"
  ]
}
