{
  "schema_version": "artifact/v1",
  "id": "req.yaml",
  "type": "requirements",
  "schema": "requirements/v2",
  "path": "output/requirements/req.yaml",
  "sha256": "b5faaa7f88eef6676eda67ca7216648a3e64e6b6083901504bed78256aeae1b7",
  "model_version": null,
  "producer": "arch-requirements",
  "produced_at": "2026-09-24T00:00:00+00:00",
  "input_artifacts": [
    "input/prompt.md",
    "input/diagrams/order-query-portal-20260914.png",
    "input/systems-registry.md",
    "input/documents/requirements.md",
    "input/api/cmdb-export.csv",
    "project.yaml",
    "config.yaml"
  ]
}
