{
  "schema_version": "artifact/v1",
  "id": "validate-result-OSP-001",
  "type": "validation-result",
  "schema": "validation/v1",
  "path": "output\\validation\\validate_result.json",
  "sha256": "902871380612cca18d93e1ce83cac1f1eab3666c57cdf006f210e0c5e9a6a9f4",
  "model_version": "openai/gpt-5.6-sol",
  "producer": "arch-validate/validation-v1",
  "produced_at": "2026-09-15T00:57:33Z",
  "input_artifacts": [
    "diagram-png",
    "blueprint-OSP-001",
    "config.yaml",
    "standards/private-cloud-standard.yaml",
    ".agents/skills/arch-validate/rules/accuracy-rules.yaml",
    ".agents/skills/arch-validate/rules/platform-rules.yaml",
    ".agents/skills/arch-validate/rules/interaction-rules.yaml",
    ".agents/skills/arch-validate/rules/security-rules.yaml",
    ".agents/skills/arch-validate/rules/diagram-rules.yaml",
    ".agents/skills/arch-validate/rules/compliance/terminology.yaml"
  ]
}
