{
  "schema_version": "artifact/v1",
  "id": "SDP-NA-001-validate-result",
  "type": "validation-result",
  "schema": "validation/v1",
  "path": "output\\validation\\validate_result.json",
  "sha256": "97f7f82334912eec8994f9b98fba7fc117e2636be2e6f76c8e93155b5fbc80b7",
  "model_version": "arch-validate/2.0",
  "producer": "arch-validate; archharness/0.7.0",
  "produced_at": "2026-09-15T00:56:09Z",
  "input_artifacts": [
    "diagram-png"
  ]
}
