{
  "schema_version": "artifact/v1",
  "id": "diagram-drawio",
  "type": "technical-deployment-view",
  "schema": "application/vnd.jgraph.mxfile",
  "path": "output/diagrams/diagram-v9.drawio",
  "sha256": "1191a940452d50ad94f0dbcbcb7990144c07ae9949de045789b3bd896a7f54b8",
  "model_version": null,
  "producer": "archharness diagram",
  "produced_at": "2026-09-14T13:39:12+00:00",
  "input_artifacts": [
    "blueprint.yaml"
  ]
}
