{
  "schema_version": "artifact/v1",
  "id": "SSOC-NA-001-blueprint-yaml",
  "type": "technical-deployment-view",
  "schema": "arch-schema-reference.yaml",
  "path": "../../output/designs/blueprint.yaml",
  "sha256": "06e4b8e92080405327ba6e47b82f1197c7157fabb672bf28db3d03ebb7ec15ef",
  "model_version": "private-cloud/2.0",
  "producer": "arch-design",
  "produced_at": "2026-09-14T13:07:56Z",
  "input_artifacts": ["SSOC-NA-001-req-yaml"]
}
